index,input_text,given_label
37191,"The last thing this issue needs is more politics and politicians - particularity smug and sanctimonious Kenney.  

Kinder Morgan needs to be far more proactive in addressing the (imo legitimate) concerns of the people of Burnaby and Vancouver.  Buying politicians like Harper to do foolish things like close the coast guard base at Kitsalano was entirely foolish and the anger and distrust of that action will stay with Vancouverites for a very long time.  Trudeau opened the base but clearly that's not enough.

Kenney's more of  same Harper short term thinking.

Notley's slow and steady should win the race, but as this author notes, Kenney smells political opportunity and he will tear Notley down rather than work with her to do anything smart on this file.

Poor Alberta with such interlopers as Kenney playing them like barking seals.",0.8
201,your comment is a reflection of how upside down and backwards most peoples views have become.  You're the worst kind of human being.,0.5423729
25139,"Never fails, when a dumb a44 lib screws thinks up, you blame someone else.  Body Odor, who gave you higher health care, etc., blamed Pres. Bush, so now it's Pres. Trumps fault.  OMG, take you head out and smell the coffee.",1.0
5410,"Dude, if you are going to post pointless inane comments, could you at least get your anatomical terms correct?  When a woman wears very tight pants, you are not seeing her vagina, but the outline of part of her vulva (specifically labia majora).

I am beyond tired of people confusing vagina with the vulva. Yes, they are connected, but they are not the same thing.",0.5733333
29355,"I just had to reply to your comment, Sans. It's really stupid. Bikers behave bad because they're a-holes, plain and simple. Hollywood, movies, TV have nothing to do with it. I highly doubt a biker's going to think, ""Gee, I just saw a movie that had bikers in it acting like j-azzes, so I'm gonna go out on my bike and act like a j-azz. Like I said, a really stupid comment.",0.77272725
16021,Bankrupt these fools. Hope the victim's family wins here. It's about time people start answering for their actions.,1.0
24543,"my god  the pathetic stupidity of lunatics that hate trump,,, the usa is the country ALL OTHERS want to go to, sell to, etc,, if anything trump standing up for his people will mean they will prosper while we decline making the demand to go to the usa even greater,,",0.8596491
36310,"Pence may be corrupt, and ignorant, but he doesn't scare the bejesus out of me like Trump. I could deal with 3 years of Pence after Trump is ousted. He comes across as a weenie puppet who no one will pay much attention to..",0.8
